{
  "version": 7,
  "updated_at": "2026-08-12T16:35:00Z",
  "platforms": {
    "openai": {
      "default_test_model": "gpt-5.4",
      "models": [
        {
          "id": "gpt-5.6-sol",
          "display_name": "GPT-5.6 Sol",
          "object": "model",
          "owned_by": "openai",
          "type": "model",
          "created": 1780876800
        },
        {
          "id": "gpt-5.6-terra",
          "display_name": "GPT-5.6 Terra",
          "object": "model",
          "owned_by": "openai",
          "type": "model",
          "created": 1780876800
        },
        {
          "id": "gpt-5.6-luna",
          "display_name": "GPT-5.6 Luna",
          "object": "model",
          "owned_by": "openai",
          "type": "model",
          "created": 1780876800
        },
        {
          "id": "gpt-5.5",
          "display_name": "GPT-5.5",
          "object": "model",
          "owned_by": "openai",
          "type": "model",
          "created": 1776873600
        },
        {
          "id": "gpt-5.4",
          "display_name": "GPT-5.4",
          "object": "model",
          "owned_by": "openai",
          "type": "model",
          "created": 1738368000
        },
        {
          "id": "gpt-5.4-mini",
          "display_name": "GPT-5.4 Mini",
          "object": "model",
          "owned_by": "openai",
          "type": "model",
          "created": 1738368000
        },
        {
          "id": "codex-auto-review",
          "display_name": "Codex Auto Review",
          "object": "model",
          "owned_by": "openai",
          "type": "model",
          "created": 1776902400
        },
        {
          "id": "gpt-image-2",
          "display_name": "GPT Image 2",
          "object": "model",
          "owned_by": "openai",
          "type": "model",
          "created": 1738368000,
          "media": {
            "image_generation": true
          }
        }
      ],
      "retired_ids": [
        "gpt-5.3-codex",
        "gpt-5.3-codex-spark",
        "gpt-image-1",
        "gpt-image-1.5",
        "gpt-image-1-mini",
        "gpt-5.2",
        "gpt-5.2-codex",
        "gpt-5.2-chat-latest"
      ],
      "aliases": {}
    },
    "anthropic": {
      "default_test_model": "claude-sonnet-4-5-20250929",
      "models": [
        {
          "id": "claude-fable-5",
          "display_name": "Claude Fable 5",
          "type": "model",
          "created_at": "2026-06-09T00:00:00Z"
        },
        {
          "id": "claude-opus-4-5-20251101",
          "display_name": "Claude Opus 4.5",
          "type": "model",
          "created_at": "2025-11-01T00:00:00Z"
        },
        {
          "id": "claude-opus-4-6",
          "display_name": "Claude Opus 4.6",
          "type": "model",
          "created_at": "2026-02-06T00:00:00Z"
        },
        {
          "id": "claude-opus-4-7",
          "display_name": "Claude Opus 4.7",
          "type": "model",
          "created_at": "2026-04-17T00:00:00Z"
        },
        {
          "id": "claude-opus-4-8",
          "display_name": "Claude Opus 4.8",
          "type": "model",
          "created_at": "2026-05-29T00:00:00Z"
        },
        {
          "id": "claude-opus-5",
          "display_name": "Claude Opus 5",
          "type": "model",
          "created_at": "2026-07-25T00:00:00Z"
        },
        {
          "id": "claude-sonnet-5",
          "display_name": "Claude Sonnet 5",
          "type": "model",
          "created_at": "2026-07-01T00:00:00Z"
        },
        {
          "id": "claude-sonnet-4-6",
          "display_name": "Claude Sonnet 4.6",
          "type": "model",
          "created_at": "2026-02-18T00:00:00Z"
        },
        {
          "id": "claude-sonnet-4-5-20250929",
          "display_name": "Claude Sonnet 4.5",
          "type": "model",
          "created_at": "2025-09-29T00:00:00Z"
        },
        {
          "id": "claude-haiku-4-5-20251001",
          "display_name": "Claude Haiku 4.5",
          "type": "model",
          "created_at": "2025-10-01T00:00:00Z"
        }
      ],
      "id_overrides": {
        "claude-sonnet-4-5": "claude-sonnet-4-5-20250929",
        "claude-opus-4-5": "claude-opus-4-5-20251101",
        "claude-haiku-4-5": "claude-haiku-4-5-20251001"
      },
      "id_reverse_overrides": {
        "claude-sonnet-4-5-20250929": "claude-sonnet-4-5",
        "claude-opus-4-5-20251101": "claude-opus-4-5",
        "claude-haiku-4-5-20251001": "claude-haiku-4-5"
      }
    },
    "gemini": {
      "default_test_model": "gemini-3.5-flash",
      "models": [
        {
          "id": "gemini-3.5-flash",
          "name": "models/gemini-3.5-flash",
          "display_name": "Gemini 3.5 Flash",
          "supported_generation_methods": [
            "generateContent",
            "streamGenerateContent"
          ]
        },
        {
          "id": "gemini-3.1-pro-preview",
          "name": "models/gemini-3.1-pro-preview",
          "display_name": "Gemini 3.1 Pro Preview",
          "supported_generation_methods": [
            "generateContent",
            "streamGenerateContent"
          ]
        },
        {
          "id": "gemini-3.1-pro-preview-customtools",
          "name": "models/gemini-3.1-pro-preview-customtools",
          "display_name": "Gemini 3.1 Pro Preview Custom Tools",
          "supported_generation_methods": [
            "generateContent",
            "streamGenerateContent"
          ]
        },
        {
          "id": "gemini-3.1-flash-image",
          "name": "models/gemini-3.1-flash-image",
          "display_name": "Gemini 3.1 Flash Image",
          "supported_generation_methods": [
            "generateContent",
            "streamGenerateContent"
          ],
          "media": {
            "image_generation": true
          }
        }
      ]
    },
    "antigravity": {
      "models": [
        {
          "id": "claude-fable-5",
          "display_name": "Claude Fable 5",
          "created_at": "2026-06-09T00:00:00Z",
          "family": "claude"
        },
        {
          "id": "claude-opus-4-5-thinking",
          "display_name": "Claude Opus 4.5 Thinking",
          "created_at": "2025-11-01T00:00:00Z",
          "family": "claude",
          "is_reasoning": true
        },
        {
          "id": "claude-sonnet-4-5",
          "display_name": "Claude Sonnet 4.5",
          "created_at": "2025-09-29T00:00:00Z",
          "family": "claude"
        },
        {
          "id": "claude-sonnet-4-5-thinking",
          "display_name": "Claude Sonnet 4.5 Thinking",
          "created_at": "2025-09-29T00:00:00Z",
          "family": "claude",
          "is_reasoning": true
        },
        {
          "id": "claude-opus-4-6",
          "display_name": "Claude Opus 4.6",
          "created_at": "2026-02-05T00:00:00Z",
          "family": "claude"
        },
        {
          "id": "claude-opus-4-6-thinking",
          "display_name": "Claude Opus 4.6 Thinking",
          "created_at": "2026-02-05T00:00:00Z",
          "family": "claude",
          "is_reasoning": true
        },
        {
          "id": "claude-opus-4-7",
          "display_name": "Claude Opus 4.7",
          "created_at": "2026-04-17T00:00:00Z",
          "family": "claude"
        },
        {
          "id": "claude-opus-4-8",
          "display_name": "Claude Opus 4.8",
          "created_at": "2026-05-29T00:00:00Z",
          "family": "claude"
        },
        {
          "id": "claude-sonnet-4-6",
          "display_name": "Claude Sonnet 4.6",
          "created_at": "2026-02-17T00:00:00Z",
          "family": "claude"
        },
        {
          "id": "gemini-3-flash",
          "display_name": "Gemini 3 Flash",
          "created_at": "2025-06-01T00:00:00Z",
          "family": "gemini"
        },
        {
          "id": "gemini-3.1-pro-low",
          "display_name": "Gemini 3.1 Pro Low",
          "created_at": "2026-02-19T00:00:00Z",
          "family": "gemini"
        },
        {
          "id": "gemini-3.1-pro-high",
          "display_name": "Gemini 3.1 Pro High",
          "created_at": "2026-02-19T00:00:00Z",
          "family": "gemini",
          "is_reasoning": true
        },
        {
          "id": "gemini-3.1-flash-image",
          "display_name": "Gemini 3.1 Flash Image",
          "created_at": "2026-02-19T00:00:00Z",
          "family": "gemini",
          "media": {
            "image_generation": true
          }
        }
      ],
      "default_mapping": {
        "claude-fable-5": "claude-fable-5",
        "claude-opus-4-8": "claude-opus-4-8",
        "claude-opus-4-7": "claude-opus-4-7",
        "claude-opus-4-6-thinking": "claude-opus-4-6-thinking",
        "claude-opus-4-6": "claude-opus-4-6-thinking",
        "claude-opus-4-5-thinking": "claude-opus-4-6-thinking",
        "claude-sonnet-4-6": "claude-sonnet-4-6",
        "claude-sonnet-4-5": "claude-sonnet-4-5",
        "claude-sonnet-4-5-thinking": "claude-sonnet-4-5-thinking",
        "claude-opus-4-5-20251101": "claude-opus-4-6-thinking",
        "claude-sonnet-4-5-20250929": "claude-sonnet-4-5",
        "claude-haiku-4-5": "claude-sonnet-4-6",
        "claude-haiku-4-5-20251001": "claude-sonnet-4-6",
        "gemini-2.5-flash": "gemini-3-flash",
        "gemini-2.5-flash-image": "gemini-3.1-flash-image",
        "gemini-2.5-flash-image-preview": "gemini-3.1-flash-image",
        "gemini-2.5-flash-lite": "gemini-3-flash",
        "gemini-2.5-flash-thinking": "gemini-3-flash",
        "gemini-2.5-pro": "gemini-pro-agent",
        "gemini-3-flash": "gemini-3-flash",
        "gemini-3-pro-high": "gemini-pro-agent",
        "gemini-3-pro-low": "gemini-3.1-pro-low",
        "gemini-3-flash-preview": "gemini-3-flash",
        "gemini-3-pro-preview": "gemini-pro-agent",
        "gemini-pro-agent": "gemini-pro-agent",
        "gemini-3.1-pro": "gemini-pro-agent",
        "gemini-3.1-pro-high": "gemini-pro-agent",